"nd","modulo","explicacion_perfil","tecnicas","adaptaciones"
"SPD","4","El procesamiento sensorial atípico puede hacer que el entorno de aprendizaje estándar sea agotador: las luces fluorescentes, el ruido de fondo, la ropa incómoda o el olor de la sala pueden consumir recursos cognitivos antes de que empiece la tarea. Optimizar el entorno sensorial no es un capricho — es una condición para que el aprendizaje pueda suceder.","Diseña tu espacio de estudio con tus necesidades sensoriales: luz cálida, temperatura cómoda, silencio o ruido controlado|Usa auriculares con cancelación de ruido para estudiar en entornos no controlados|Identifica qué estimulación sensorial te ayuda a concentrarte — para algunos es música, para otros silencio total|Toma descansos sensoriales activos: salir al aire libre, movimiento, cambio de entorno|Estudia cuando tu sistema sensorial esté más regulado — no durante ni justo después de una sobrecarga","Solicita poder usar auriculares o tapones durante clases o pruebas|Pide un espacio con menos estímulos sensoriales para evaluaciones si el entorno estándar genera sobrecarga|En casa o trabajo, negocia condiciones de entorno que favorezcan tu concentración|Comunica tus necesidades sensoriales como parte de tu forma de funcionar, no como queja"
"Tartamudez","4","La tartamudez no afecta al aprendizaje ni a la comprensión. El mayor impacto en el entorno educativo y laboral viene de las situaciones de habla pública: leer en voz alta, participar oralmente o hacer presentaciones puede generar ansiedad anticipatoria que interfiere con el rendimiento. La evaluación basada solo en expresión oral puede ser inequitativa.","Prepara con antelación las intervenciones orales que sean predecibles — guión, puntos clave, práctica previa|Identifica qué situaciones de habla son más difíciles y trabájalas gradualmente con apoyo si es posible|El conocimiento profundo del tema reduce la ansiedad y, con ella, la disfluencia|Las evaluaciones escritas son un canal completamente equivalente — no las evites por preferir el oral|Trabaja la aceptación de la disfluencia: intentar ocultarla genera más tensión que gestionarla abiertamente","Solicita alternativas a la lectura en voz alta o participación oral obligatoria|Pide que las presentaciones puedan hacerse en formato escrito, visual o grabado|En entornos educativos, comunica la tartamudez al profesorado para que no se reaccione ante las disfluencias|Solicita tiempo adicional en evaluaciones orales"
"Discapacidad Intelectual","4","El aprendizaje con discapacidad intelectual requiere más tiempo, más repetición y más apoyos concretos. El aprendizaje funcional y contextualizado — aprender haciendo, en situaciones reales — suele ser más efectivo que el abstracto. La motivación y el entorno de seguridad son factores especialmente importantes.","Aprende haciendo: conecta cada contenido con una aplicación práctica concreta|Usa apoyos visuales constantes: pictogramas, esquemas, colores, imágenes|Divide cada tarea en pasos muy pequeños y celebra cada paso completado|La repetición en contextos variados consolida el aprendizaje mejor que el estudio intensivo|Trabaja con rutinas claras y predecibles — la estructura reduce la carga cognitiva","Solicita materiales adaptados: texto simplificado, apoyo visual, pasos desglosados|Pide tiempo adicional y posibilidad de hacer las tareas en varias sesiones|En entornos educativos, solicita apoyo individualizado o trabajo en grupos pequeños|Comunica qué formatos de evaluación son más accesibles para ti"
"TOC","4","El TOC puede interferir en el aprendizaje a través de las compulsiones: revisar repetidamente los apuntes, reescribir hasta que 'quede bien', no poder pasar al siguiente punto hasta haber resuelto el anterior perfectamente. Esto genera bloqueos, agotamiento y sensación de no avanzar aunque se esté trabajando mucho.","Practica el aprendizaje suficientemente bueno: pasar página aunque no esté perfecto es parte del proceso|Pon límites de tiempo a las revisiones — cuando suena el temporizador, se pasa al siguiente tema|Usa el borrador como herramienta: escribir mal a propósito para luego mejorar rompe el ciclo perfectcionista|Identifica cuándo estás en un bucle compulsivo de estudio y aplica una interrupción deliberada|Trabaja con apoyo profesional las compulsiones relacionadas con el estudio si son muy limitantes","Comunica al profesorado o formadores que necesitas límites de tiempo claros para las tareas — los plazos abiertos aumentan las compulsiones|Solicita feedback parcial durante el proceso, no solo al final — reduce la incertidumbre que alimenta el TOC|Acuerda con personas de apoyo señales para identificar y salir de bucles de revisión"
"Mutismo Selectivo","4","El mutismo selectivo afecta principalmente a la participación oral en entornos educativos o laborales donde hay evaluación social. El aprendizaje en sí suele estar completamente preservado. El mayor reto es demostrar ese aprendizaje en un sistema que valora mucho la expresión oral.","Identifica los formatos de evaluación y participación donde te sientes más cómodo/a y úsalos siempre que puedas|La escritura, los proyectos y las entregas digitales son completamente equivalentes a la expresión oral|Trabaja la exposición gradual al entorno de aprendizaje: desde observar hasta participar, a tu ritmo|El aprendizaje autónomo — lectura, vídeos, práctica individual — puede ser especialmente cómodo|Celebra la participación en cualquier formato, no solo la oral","Solicita alternativas a la participación oral obligatoria: entregas escritas, grabaciones, proyectos|Pide que el profesorado no te llame a participar de forma inesperada|Comunica con antelación al profesorado o responsables para que puedan crear condiciones de seguridad|En trabajo, solicita poder contribuir por escrito en reuniones o presentaciones"
"Trastorno de Ansiedad Social","4","La ansiedad social puede interferir en el aprendizaje en entornos grupales, en las evaluaciones orales y en cualquier situación donde el rendimiento sea observado. La ansiedad anticipatoria puede consumir recursos cognitivos antes incluso de que empiece la tarea. En condiciones de bajo estrés social, el aprendizaje suele ser completamente fluido.","Prepara con antelación las situaciones de aprendizaje social que generen más ansiedad|Usa el aprendizaje autónomo y en solitario como base sólida antes de la exposición grupal|Practica la autocompasión: cometer errores delante de otros es parte del aprendizaje, no una catástrofe|Identifica los entornos de aprendizaje donde la ansiedad es más manejable y úsalos como punto de partida|Trabaja con apoyo profesional si la ansiedad social limita significativamente el acceso a la formación","Solicita alternativas a presentaciones o evaluaciones orales en grupo|Pide poder hacer preguntas al profesorado de forma individual, no solo en clase|En entornos laborales, solicita recibir el orden del día de las reuniones con antelación|Comunica que el trabajo en solitario o en parejas puede ser más productivo para ti que el trabajo en grupo grande"
"TANV","4","El trastorno de aprendizaje no verbal afecta especialmente a las materias con componente visual-espacial: matemáticas, geometría, mapas, gráficas. El lenguaje verbal y la memoria verbal son puntos fuertes. Las dificultades aparecen cuando hay que integrar información visual compleja, inferir reglas no explícitas o adaptarse a situaciones nuevas.","Apóyate en tu fortaleza verbal: convierte los problemas visuales en descripciones verbales paso a paso|Solicita explicaciones verbales explícitas de lo que otros entienden visualmente de forma intuitiva|Usa reglas explícitas y procedimientos paso a paso para resolver problemas — evita la intuición visual|La lectura y la escritura son tus canales fuertes — úsalos para consolidar cualquier aprendizaje|Anticipa las situaciones nuevas con información verbal detallada — el TANV necesita contexto explícito","Solicita que los contenidos visuales (mapas, gráficas, esquemas) vengan acompañados de explicación verbal|Pide instrucciones explícitas y detalladas para tareas nuevas — no des por sentado que lo implícito se entiende|En evaluaciones con componente espacial o visual, solicita tiempo adicional|Comunica al profesorado que necesitas que las reglas implícitas se hagan explícitas"
"Dislexia","5","La dislexia no afecta directamente a las habilidades sociales, pero puede generar inseguridad en situaciones donde la lectura o escritura tienen un rol social: leer en voz alta en grupo, escribir mensajes rápidos, participar en chats. El impacto social de la dislexia es principalmente emocional: vergüenza, evitación o sensación de ser menos capaz.","Sé selectivo/a con los entornos sociales digitales: no tienes que participar en todos los chats grupales|Comparte con personas de confianza que tienes dislexia — la comprensión reduce la presión|Busca grupos sociales donde el lenguaje escrito no sea el canal principal de interacción|Recuerda que tu valor en una relación no depende de tu ortografía|Las notas de voz son completamente válidas en entornos informales — úsalas sin vergüenza","Comunica a personas cercanas que prefieres comunicación oral o por voz sobre texto escrito|Pide que no se comenten errores ortográficos en mensajes informales|Normaliza con tu entorno que tardas más en responder mensajes escritos — no es descortesía"
"TDAH","5","El TDAH puede generar dificultades sociales relacionadas con la impulsividad, la dificultad para escuchar sin interrumpir y el olvido de compromisos sociales. Esto puede interpretarse erróneamente como desinterés o falta de respeto. Al mismo tiempo, la energía, el entusiasmo y la creatividad de las personas con TDAH pueden ser muy valorados socialmente.","Usa un calendario o app de recordatorios para los planes sociales — el olvido no es falta de interés|Practica la escucha activa: cuando notes que quieres interrumpir, anota mentalmente el punto y espera|Elige entornos sociales con estructura o actividad — las conversaciones sin guión pueden ser más difíciles|Si cancelas planes con frecuencia, comunícalo con honestidad — la transparencia mantiene las relaciones|Busca amigos y comunidades que valoren tu energía y espontaneidad en lugar de juzgar tu impulsividad","Pide a personas cercanas que te recuerden los planes con anticipación, no solo el día antes|Acuerda señales con amigos de confianza para cuando estés dominando demasiado la conversación|Normaliza con tu entorno que necesitas más estructura en los planes para poder cumplirlos"
"TEA","5","La socialización en el TEA sigue reglas diferentes, no ausentes. Las personas autistas suelen preferir relaciones profundas y honestas sobre las superficiales y convencionales. Los entornos sociales no estructurados, con mucha gente y reglas implícitas, pueden ser agotadores. Pero en contextos adecuados — grupos de interés compartido, relaciones individuales de confianza — la conexión es plena.","Busca grupos organizados en torno a intereses compartidos — la actividad da estructura a la interacción|La calidad sobre la cantidad: una o dos relaciones profundas son completamente válidas|Identifica tus límites de socialización y respétalos — el agotamiento social (autistic burnout) es real|Aprende a reconocer cuándo necesitas tiempo de recuperación después de interacciones sociales exigentes|Comunica tus necesidades sociales con honestidad a las personas de confianza — quienes te quieren bien lo entenderán","Pide a amigos y familiares que entiendan que necesitas tiempo de descanso después de socializar|Normaliza que prefieres planes con estructura y aviso previo sobre los espontáneos|Comunica que el silencio compartido no es incomodidad — para muchas personas autistas es una forma de conexión|Busca comunidades autistas o neurodivergentes donde las normas sociales sean más explícitas y flexibles"
"AACC","5","Las personas con altas capacidades pueden experimentar dificultades para encontrar pares con quienes conectar a nivel intelectual y emocional. La intensidad con la que viven las relaciones puede resultar abrumadora para otros. La doble excepcionalidad (AACC + otra ND) puede añadir una capa más de complejidad a la socialización.","Busca activamente comunidades donde tu nivel de intensidad e interés sea bienvenido|Aprende a modular la intensidad según el contexto — no cada relación tiene que ser profunda|La soledad elegida es completamente válida — no toda persona con AACC necesita una red social amplia|Trabaja la tolerancia a la imperfección de las relaciones — las personas no siempre estarán a tu nivel y eso está bien|Cultiva relaciones con personas de distintos perfiles — la diversidad enriquece aunque no siempre haya sintonía total","Busca grupos o comunidades de AACC, filosofía, ciencia, arte o cualquier área de profundo interés|Comunica a personas cercanas que necesitas conversaciones sustanciales, no solo charla social|Normaliza que tienes un círculo social pequeño pero intenso — eso no es un problema"
"Discalculia","5","La discalculia no afecta directamente a la socialización. El impacto social puede aparecer en situaciones donde los números tienen un rol: dividir cuentas, calcular propinas, seguir horarios grupales. La inseguridad generada puede llevar a la evitación de ciertas situaciones sociales.","Usa apps de calculadora o división de cuentas para situaciones con números en entornos sociales|Sé directo/a con amigos de confianza: 'los números se me dan mal, ¿puedes ayudarme con esto?'|Elige roles en planes grupales que no dependan del cálculo numérico|No dejes que la inseguridad con los números te haga evitar situaciones sociales que disfrutes","Pide a personas cercanas que no llamen la atención sobre tus dificultades con los números en público|Normaliza el uso de apoyo externo para cálculos en situaciones sociales — todo el mundo usa el móvil"
"Dispraxia/TDC","5","La dispraxia puede generar dificultades en actividades sociales con componente motor: deportes de equipo, baile, juegos de habilidad física. Esto puede generar exclusión o vergüenza en entornos donde esas actividades son centrales. La socialización en sí no está comprometida.","Busca actividades sociales que no dependan de la coordinación motora como eje principal|Comunica con humor y naturalidad tus dificultades motrices — la autoaceptación desactiva la incomodidad social|Elige deportes o actividades físicas adaptadas o de bajo componente coordinativo si quieres la dimensión física|Los juegos de mesa, conversación, arte u otras actividades pueden ser excelentes ejes sociales","Pide a amigos que elijan actividades sociales variadas, no siempre centradas en lo físico|Normaliza con tu entorno que el deporte de equipo no es tu fuerte sin que eso suponga exclusión"
"Síndrome de Tourette","5","El síndrome de Tourette puede generar situaciones de incomodidad social por la reacción de otros ante los tics. Esto puede llevar a la evitación de situaciones sociales o a un esfuerzo agotador de supresión en público. Con el tiempo y con entornos de aceptación, la mayoría de personas con Tourette construyen redes sociales sólidas.","Elige con quién compartir información sobre el Tourette y cuándo — es tu información|Prepara respuestas breves y tranquilas para reacciones de desconocidos: normaliza sin exceso de explicación|Busca comunidades y grupos donde el Tourette sea conocido y aceptado|La aceptación propia es la base de la aceptación social — cuanto más cómodo/a estés tú, más cómodos estarán los demás|Conecta con otras personas con Tourette — la comprensión mutua es especialmente valiosa","Informa a amigos y familia sobre el Tourette para que puedan apoyarte y normalizar ante otros|Pide que no comenten ni reaccionen a los tics en situaciones sociales|Busca entornos sociales donde ya haya comprensión o donde puedas educar sin agotarte"
"SPD","5","El procesamiento sensorial atípico puede hacer que los entornos sociales típicos — bares, fiestas, conciertos, restaurantes ruidosos — sean difíciles de tolerar. Esto puede generar la percepción de que la persona evita socializar, cuando en realidad evita los estímulos del entorno, no a las personas.","Propón entornos alternativos para socializar: espacios tranquilos, al aire libre, casas en lugar de locales|Comunica tus necesidades sensoriales con naturalidad: 'prefiero sitios menos ruidosos'|Planifica el tiempo de recuperación después de entornos sensorialmente exigentes|Busca amigos que valoren los planes tranquilos tanto como los planes de alto estímulo|Lleva siempre contigo tus herramientas de regulación sensorial: tapones, auriculares, gafas de sol","Pide a amigos que consideren tus necesidades sensoriales al elegir planes|Normaliza salir antes de tiempo si la sobrecarga es mucha — sin necesidad de gran explicación|Comunica a personas cercanas que necesitas tiempo de recuperación después de socializar en entornos exigentes"
"Tartamudez","5","La tartamudez puede generar ansiedad social específica en situaciones donde hay que hablar: presentaciones, conocer gente nueva, pedir en un bar. Esto puede llevar a la evitación social o al camuflaje, que resulta agotador. La socialización plena es completamente posible con el apoyo adecuado y la aceptación propia.","Trabaja la aceptación de la tartamudez como parte de ti — la incomodidad de los demás es su trabajo, no el tuyo|Practica situaciones sociales de bajo riesgo para ganar confianza gradualmente|Informa a personas nuevas sobre la tartamudez cuando lo consideres oportuno — reduce la tensión de ambos lados|Busca comunidades de personas con tartamudez — la identificación y el apoyo mutuo son muy valiosos|Celebra cada situación social donde hayas participado plenamente, independientemente de la fluidez","Pide a amigos que no terminen tus frases ni reaccionen a las disfluencias|Normaliza que necesitas un momento antes de hablar en situaciones nuevas|Busca grupos sociales donde la comunicación sea valorada por su contenido, no por su forma"
"Discapacidad Intelectual","5","La socialización es una dimensión especialmente importante para las personas con discapacidad intelectual. Las relaciones de apoyo, amistad y pertenencia contribuyen directamente al bienestar. Los retos pueden aparecer en la lectura de intenciones sociales, en la asertividad o en el manejo de situaciones sociales complejas.","Practica habilidades sociales básicas en entornos seguros y de confianza|Aprende a reconocer situaciones de abuso o manipulación con apoyo de personas de confianza|Busca grupos sociales estructurados con actividades claras — reducen la ambigüedad social|Celebra y refuerza las relaciones positivas que ya tienes|La red de apoyo — familia, cuidadores, amigos — es un recurso valioso, no una limitación","Busca actividades sociales adaptadas o en grupos de apoyo con personas de perfiles similares|Pide a familiares y cuidadores que apoyen la creación de vínculos sociales sin sobreproteger|Comunica cuándo una situación social te genera malestar para que personas de confianza puedan ayudar"
"TOC","5","El TOC puede generar dificultades sociales cuando las obsesiones o compulsiones interfieren en las relaciones: miedo a contaminar, a dañar a otros, rituales visibles en público, peticiones repetidas de reaseguración. La persona con TOC puede evitar situaciones sociales para evitar los desencadenantes o por vergüenza.","Trabaja con apoyo profesional las obsesiones que más impactan en tu vida social|Informa a personas muy cercanas sobre el TOC cuando la relación lo permita — la comprensión reduce la tensión|Practica tolerar la incertidumbre social: no siempre puedes saber cómo te han percibido|Busca comunidades de personas con TOC — la normalización y el apoyo mutuo son muy valiosos|Distingue entre evitación por comodidad y evitación compulsiva — la segunda alimenta el TOC","Pide a personas muy cercanas que no respondan a peticiones repetidas de reaseguración social|Normaliza con tu entorno que a veces necesitas retirarte de situaciones sociales para gestionar la ansiedad|Busca grupos sociales de apoyo para personas con TOC o ansiedad"
"Mutismo Selectivo","5","El mutismo selectivo tiene un impacto directo en la socialización, especialmente en contextos nuevos o con personas desconocidas. Puede generar aislamiento social no deseado o malinterpretarse como arrogancia o desinterés. Las relaciones profundas y de confianza son completamente posibles — el reto está en los primeros contactos.","Construye relaciones desde canales alternativos: texto, mensajes, actividades compartidas sin necesidad de habla inicial|Busca entornos sociales donde el silencio sea aceptable: actividades en paralelo, naturaleza, juegos|Comunica de alguna forma — gesto, nota, mensaje — que estás presente aunque no puedas hablar|Trabaja la exposición gradual a situaciones sociales nuevas con apoyo profesional si es posible|Celebra cada conexión social que hayas podido establecer, en el formato que sea","Pide a amigos de confianza que actúen como puente en situaciones sociales nuevas|Normaliza con tu círculo que no hablar no significa no querer estar|Busca comunidades online o grupos de interés donde la interacción escrita sea la norma"
"Trastorno de Ansiedad Social","5","La ansiedad social afecta directamente a la cantidad y calidad de las interacciones sociales. El miedo al juicio, a decir algo inadecuado o a ser rechazado puede llevar a la evitación progresiva que, a su vez, refuerza la ansiedad. La exposición gradual con apoyo es el camino más efectivo.","Empieza por situaciones sociales de bajo riesgo y ve ampliando gradualmente|Trabaja la autocompasión: cometer errores sociales es universal, no una catástrofe personal|Practica desafiar los pensamientos de catástrofe social: ¿qué probabilidad real hay de que pase lo peor?|Busca grupos o actividades con estructura — reducen la incertidumbre de la interacción libre|Trabaja con apoyo profesional si la evitación social está limitando significativamente tu vida","Pide a personas cercanas que te avisen antes de situaciones sociales inesperadas|Normaliza que necesitas tiempo de recuperación después de socializar|Busca grupos de apoyo para ansiedad social — saber que no estás solo/a tiene un efecto muy potente"
"TANV","5","El trastorno de aprendizaje no verbal puede generar dificultades sociales por la dificultad para leer el lenguaje no verbal: expresiones faciales, tono de voz, lenguaje corporal. Las reglas sociales implícitas pueden resultar confusas. Esto puede generar malentendidos frecuentes o sensación de no encajar, a pesar de tener buenas intenciones sociales.","Aprende reglas sociales de forma explícita — lo que para otros es intuición para ti puede ser conocimiento|Practica preguntar directamente cuando no entiendas una situación social|Busca personas que sean directas y explícitas en su comunicación — son más fáciles de leer|La amistad basada en actividades compartidas o conversación verbal puede ser más cómoda que la que depende del lenguaje no verbal|Trabaja con apoyo profesional los aspectos pragmáticos de la interacción social si generan muchos problemas","Pide a personas cercanas que sean explícitas sobre sus estados emocionales y sus intenciones|Normaliza que necesitas más contexto en situaciones sociales ambiguas|Busca grupos sociales con normas claras y explícitas — los entornos muy informales pueden ser más difíciles"
"Dislexia","6","La dislexia no afecta directamente a la propiocepción ni al procesamiento sensorial en la mayoría de los casos. Sin embargo, la tensión acumulada por el esfuerzo cognitivo constante puede manifestarse corporalmente: fatiga, tensión cervical, dolores de cabeza relacionados con la lectura prolongada. El cuerpo necesita descanso activo después de esfuerzos lectores intensos.","Incorpora pausas activas durante la lectura o escritura: cada 20-30 minutos, movimiento y descanso visual|Practica la regla 20-20-20: cada 20 minutos, mira a 20 metros durante 20 segundos para descansar la vista|El movimiento antes del estudio puede mejorar la activación y reducir la fatiga posterior|Explora si hay condiciones de luz que faciliten la lectura — algunos perfiles con dislexia se benefician de overlays de color|Identifica cómo se manifiesta el agotamiento lector en tu cuerpo y toma eso como señal de pausa","Organiza el espacio de lectura y escritura con buena iluminación y sin reflejos|Pide pausas activas en sesiones largas de trabajo escrito|Explora con un especialista si los overlays de color o lentes tintadas pueden reducir la fatiga visual"
