"nd","modulo","explicacion_perfil","tecnicas","adaptaciones"
"TDAH","6","Las personas con TDAH suelen tener una relación intensa con el cuerpo: alta energía, necesidad de movimiento, dificultad para permanecer quietos durante mucho tiempo. La hiperactividad física no es un problema a eliminar sino una necesidad a canalizar. El movimiento no solo no interfiere con la concentración — para muchos la mejora.","Incorpora movimiento en tu rutina de estudio o trabajo: pasea mientras piensas, usa una pelota de ejercicio, haz pausa activa|Practica deporte o actividad física regular — regula la dopamina y mejora la función ejecutiva de forma sostenida|El fidgeting (juguetes antiestrés, bolígrafos para maniobrar) puede ayudar a mantener la concentración sin distraer|Identifica qué nivel de activación física necesitas para estar en tu punto óptimo de atención|Explora la meditación de movimiento (yoga, tai chi) como alternativa a la meditación estática","Pide poder levantarte y moverte durante sesiones largas de trabajo o estudio|Solicita la posibilidad de usar herramientas de fidgeting discretas en clase o reuniones|Negocia con tu entorno pausas activas regulares en lugar de sesiones largas sin movimiento"
"TEA","6","Muchas personas autistas tienen un perfil sensorial atípico: hipo o hipersensibilidad en distintas modalidades sensoriales. El procesamiento sensorial puede ser intenso y agotador en entornos no controlados. La propiocepción también puede estar afectada: la conciencia del propio cuerpo, la tolerancia al tacto y la necesidad de estimulación profunda varían mucho entre personas.","Mapea tu perfil sensorial: ¿qué sentidos son hipersensibles? ¿cuáles hiposensibles? Eso define tus estrategias|La estimulación propioceptiva profunda — mantas con peso, ropa ajustada, presión firme — puede ser muy reguladora|Identifica tus estresores sensoriales principales y diseña estrategias de evitación o amortiguación|Los stims (movimientos repetitivos de autorregulación) no son un problema — son una herramienta. No los suprimas|Crea un espacio o rutina de descompresión sensorial para después de entornos exigentes","Organiza tu entorno doméstico o de trabajo con tus necesidades sensoriales como prioridad|Informa a personas cercanas sobre tus necesidades sensoriales para que puedan apoyarte|Trabaja con un terapeuta ocupacional especializado en sensorialidad si el perfil sensorial interfiere significativamente en tu vida"
"AACC","6","Las personas con altas capacidades suelen tener una sensibilidad elevada también a nivel físico: mayor reactividad al dolor, al ruido, a las texturas, a la temperatura. Esto está relacionado con la sobreexcitabilidad psicomotriz y sensorial descrita por Dabrowski. El cuerpo puede ser un canal de procesamiento emocional e intelectual de alta intensidad.","Reconoce la sobreexcitabilidad sensorial como parte de tu perfil — no es exageración|Practica actividades físicas que canalicen la energía y la intensidad: deporte, danza, artes marciales|El contacto con la naturaleza puede ser especialmente regulador para perfiles de alta sensibilidad|Trabaja el autocuidado corporal como práctica consciente, no como obligación|Explora técnicas de regulación que combinen cuerpo y mente: yoga, mindfulness, respiración","Organiza tu entorno con atención a los estresores sensoriales que más te afectan|Comunica a personas cercanas que tu sensibilidad física es real y no una exageración|Busca actividades físicas que disfrutes y que te regulen, no solo las que se supone que deberías hacer"
"Discalculia","6","La discalculia no afecta directamente a la propiocepción ni al procesamiento sensorial. Sin embargo, puede generar dificultades en actividades que implican estimaciones de tiempo, distancia o cantidad corporal: calcular cuánto tiempo llevas caminando, estimar distancias, seguir ritmos musicales basados en conteo.","Usa apoyos externos para la gestión temporal del cuerpo: temporizadores, alarmas, recordatorios de movimiento|Practica actividades físicas sin componente de conteo o medición estricta: paseo libre, baile intuitivo, natación|Explora el movimiento como experiencia sensorial en lugar de como rendimiento medible|Trabaja la interocepcón: aprende a escuchar las señales de tu cuerpo (hambre, cansancio, tensión) como información","Usa alarmas para recordar pausas de movimiento o descanso en lugar de depender del sentido del tiempo|Elige actividades físicas donde el conteo no sea central si te genera estrés"
"Dispraxia/TDC","6","La dispraxia afecta directamente a la propiocepción y a la planificación motora. La conciencia del propio cuerpo en el espacio puede ser reducida, lo que genera torpeza, dificultad para aprender movimientos nuevos y fatiga al realizar tareas motoras que para otros son automáticas. El cuerpo requiere más atención consciente para funciones que en otros son inconscientes.","La terapia ocupacional es el recurso más efectivo — un profesional puede diseñar un programa personalizado|Practica actividades que mejoren la propiocepción: yoga, tai chi, natación — movimientos lentos y conscientes|El entrenamiento motor requiere mucha más repetición que en personas sin dispraxia — normaliza ese ritmo|Trabaja la conciencia corporal de forma explícita: ejercicios de atención al cuerpo, respiración, equilibrio|El cansancio físico en tareas motoras cotidianas es real — programa descansos y no te exijas el estándar de otro","Trabaja con un terapeuta ocupacional si las dificultades motrices afectan a las actividades cotidianas|Organiza el entorno para reducir las demandas motoras: objetos accesibles, superficies despejadas|Elige actividades físicas adaptadas a tu perfil motor — el deporte de equipo de alta coordinación puede no ser la mejor opción|Pide apoyo sin vergüenza en tareas que requieran coordinación fina o gruesa"
"Síndrome de Tourette","6","El síndrome de Tourette implica tics motores que el cuerpo realiza de forma involuntaria. La supresión activa de tics consume energía física y cognitiva significativa. Después de periodos de supresión, suele haber un rebote de tics. El cuerpo necesita espacios donde los tics puedan expresarse libremente para recuperarse.","Crea espacios y momentos donde puedas liberar tics sin presión social — es necesario para el bienestar|Identifica qué situaciones aumentan la frecuencia de tics (estrés, cansancio, emoción intensa) y gestiona esas variables|El ejercicio físico puede reducir la frecuencia de tics en algunas personas — explora qué funciona para ti|Técnicas de relajación y mindfulness pueden ayudar a gestionar la tensión asociada a los tics|Trabaja con un neurólogo o psicólogo especializado si los tics son muy limitantes","Crea en casa un entorno donde los tics no necesiten ser suprimidos|Comunica a personas cercanas que necesitas momentos de descompresión sin expectativas|Busca actividades físicas donde el movimiento sea libre y los tics no interfieran"
"SPD","6","El trastorno de procesamiento sensorial es, por definición, una condición que afecta profundamente a la experiencia corporal. El sistema nervioso procesa los estímulos sensoriales de forma diferente: algunos son amplificados (hipersensibilidad), otros apenas registrados (hiposensibilidad). La regulación sensorial es el trabajo central de este módulo.","Mapea detalladamente tu perfil sensorial con ayuda de un terapeuta ocupacional si es posible|La estimulación propioceptiva profunda (mantas con peso, abrazo firme, ejercicio de resistencia) es reguladora para muchos perfiles SPD|Crea una 'dieta sensorial' personalizada: qué estimulación necesitas, cuándo y cómo incorporarla en el día|Identifica tus señales de sobrecarga sensorial temprana para actuar antes de llegar al colapso|El entorno físico es tu primera herramienta: luz, sonido, temperatura, texturas — controla lo que puedas","Trabaja con un terapeuta ocupacional especializado en procesamiento sensorial|Organiza tu espacio de vida con tus necesidades sensoriales como criterio principal|Informa a personas cercanas sobre tu perfil sensorial para que puedan apoyarte y evitar desencadenantes|Comunica en entornos laborales o educativos las adaptaciones de entorno que necesitas"
"Tartamudez","6","La tartamudez tiene una importante dimensión corporal: la tensión muscular en garganta, mandíbula y pecho, la respiración que se altera antes de situaciones difíciles, la activación fisiológica del estrés anticipatorio. Trabajar el cuerpo es una parte esencial del abordaje de la tartamudez, complementaria al trabajo logopédico.","Practica la respiración diafragmática como técnica de regulación antes de situaciones de habla difíciles|Trabaja la relajación muscular progresiva, especialmente en cuello, mandíbula y hombros|El ejercicio físico regular ayuda a gestionar la activación general y reduce la tensión basal|La conciencia corporal (mindfulness, yoga) puede ayudar a detectar y liberar tensiones antes de hablar|Explora técnicas de fluidez con un logopeda especializado en tartamudez","Busca espacios físicos donde te sientas cómodo/a para practicar el habla sin tensión|Incorpora rutinas de relajación física antes de situaciones sociales o laborales exigentes|Trabaja con un logopeda especializado si todavía no lo haces"
"Discapacidad Intelectual","6","La conciencia corporal y la regulación sensorial son áreas que pueden requerir apoyo específico en la discapacidad intelectual. El reconocimiento de las propias necesidades físicas (hambre, cansancio, malestar, placer) y la expresión de esas necesidades puede necesitar trabajo explícito.","Trabaja el reconocimiento de sensaciones corporales básicas con apoyos visuales si es necesario|Establece rutinas corporales predecibles: horas de comida, descanso, movimiento|La actividad física regular y placentera contribuye al bienestar general y a la regulación|Practica nombrar sensaciones físicas: 'tengo calor', 'me duele aquí', 'estoy cansado/a'|El contacto con la naturaleza y el movimiento libre tienen efectos muy positivos en el bienestar","Crea rutinas corporales claras y predecibles con apoyo de familiares o cuidadores|Trabaja con un terapeuta ocupacional si hay dificultades significativas de procesamiento sensorial o propiocepción|Enseña y practica la comunicación de necesidades físicas en entornos seguros"
"TOC","6","El TOC tiene una dimensión corporal importante: la ansiedad se manifiesta físicamente (tensión, taquicardia, sensación de urgencia) y muchas compulsiones implican el cuerpo (lavado, comprobación, rituales físicos). Aprender a regular la respuesta corporal de ansiedad es una parte esencial del manejo del TOC.","Aprende a reconocer las señales físicas tempranas del TOC: dónde se manifiesta la ansiedad en tu cuerpo|La activación física (ejercicio aeróbico) reduce la ansiedad general y puede interrumpir ciclos obsesivos|Técnicas de regulación del sistema nervioso (respiración, movimiento, frío) pueden ayudar en momentos de alta compulsión|Practica tolerancia a la incomodidad física asociada a no realizar la compulsión — es temporal|Trabaja con un profesional la respuesta corporal de ansiedad como parte del tratamiento del TOC","Incorpora actividad física regular como parte del manejo del TOC|Crea rutinas de regulación corporal para momentos de alta ansiedad|Trabaja con un psicólogo especializado en TOC — el abordaje corporal es parte del tratamiento integral"
"Mutismo Selectivo","6","El mutismo selectivo tiene una base de ansiedad que se manifiesta físicamente: bloqueo vocal, tensión muscular, activación del sistema nervioso autónomo. Trabajar la regulación del sistema nervioso es fundamental para reducir la respuesta de congelación que impide hablar.","Practica técnicas de regulación del sistema nervioso: respiración lenta, movimiento suave, contacto con el suelo|El ejercicio físico regular reduce la activación basal de ansiedad|Identifica en tu cuerpo las señales de que la ansiedad está subiendo antes del bloqueo — ese es el momento de actuar|El yoga, el tai chi o la danza pueden ser formas de conectar con el cuerpo y regular el sistema nervioso|Trabaja con un psicólogo especializado en ansiedad y mutismo selectivo","Crea rutinas de regulación corporal antes de situaciones potencialmente difíciles|Incorpora movimiento y descanso en tu día como herramientas de regulación, no como obligaciones|Busca apoyo profesional si la respuesta de ansiedad corporal es muy intensa o frecuente"
"Trastorno de Ansiedad Social","6","La ansiedad social tiene una expresión corporal clara: taquicardia, sudoración, rubor, tensión muscular, temblor. Estos síntomas físicos pueden ser percibidos por la persona y aumentar la ansiedad ('me van a notar'). Trabajar la regulación corporal de la ansiedad es tan importante como trabajar los pensamientos.","Aprende a reconocer tu respuesta física de ansiedad social — ¿dónde la notas? ¿cómo empieza?|Practica la respiración abdominal lenta como técnica de regulación inmediata en situaciones de ansiedad|El ejercicio aeróbico regular es uno de los ansiolíticos naturales más efectivos|Practica la exposición gradual a situaciones de activación moderada — el cuerpo aprende que puede manejarla|Trabaja con un profesional si la respuesta física de ansiedad es muy intensa o limitante","Incorpora actividad física regular como parte del manejo de la ansiedad social|Crea rutinas de regulación antes de situaciones sociales exigentes|Trabaja con un psicólogo especializado en ansiedad social — el abordaje corporal es parte del tratamiento"
"TANV","6","El trastorno de aprendizaje no verbal puede incluir dificultades propioceptivas: la conciencia del cuerpo en el espacio, la coordinación y el equilibrio pueden ser áreas de dificultad. Además, la integración sensorial visual-espacial puede afectar a la orientación en el entorno físico.","Trabaja la conciencia corporal de forma explícita: yoga, tai chi, ejercicios de equilibrio consciente|El movimiento lento y consciente puede mejorar la propiocepción mejor que el deporte de alta velocidad|Usa apoyos externos para la orientación espacial: mapas, referencias visuales, GPS|Practica actividades físicas donde el componente espacial sea simple y predecible|Trabaja con un terapeuta ocupacional si las dificultades propioceptivas afectan a las actividades cotidianas","Organiza el entorno físico de forma clara y predecible para reducir la demanda de orientación espacial|Trabaja con un terapeuta ocupacional si hay dificultades significativas de propiocepción o integración sensorial|Comunica a personas cercanas que la orientación en el espacio puede ser más difícil para ti"
